key,category,exerciseName,name_en,name_fr
BANDED_EXERCISES_AB_TWIST,BANDED_EXERCISES,AB_TWIST,Banded Ab Twist,Torsion abdominale avec élastique
BANDED_EXERCISES_AROUND_THE_WORLD_WHEELCHAIR,BANDED_EXERCISES,AROUND_THE_WORLD_WHEELCHAIR,Banded Around The World,Quart de tour avec élastique
BANDED_EXERCISES_BACK_EXTENSION,BANDED_EXERCISES,BACK_EXTENSION,Banded Back Extension,Extension du dos avec élastique
BANDED_EXERCISES_BANDED_EXERCISES,BANDED_EXERCISES,BANDED_EXERCISES,Banded Exercises,Exercices avec bandes
BANDED_EXERCISES_BICYCLE_CRUNCH,BANDED_EXERCISES,BICYCLE_CRUNCH,Banded Bicycle Crunch,Abdominaux bicyclette avec élastique
BANDED_EXERCISES_CALF_RAISES,BANDED_EXERCISES,CALF_RAISES,Banded Calf Raises,Élévations du mollet avec élastique
BANDED_EXERCISES_CHEST_FLY_DECLINE_WHEELCHAIR,BANDED_EXERCISES,CHEST_FLY_DECLINE_WHEELCHAIR,Banded Decline Chest Fly,Tirage vers le bas avec élastique
BANDED_EXERCISES_CHEST_FLY_INCLINE_WHEELCHAIR,BANDED_EXERCISES,CHEST_FLY_INCLINE_WHEELCHAIR,Banded Incline Chest Fly,Tirage vers le haut avec élastique
BANDED_EXERCISES_CLAM_SHELLS,BANDED_EXERCISES,CLAM_SHELLS,Banded Clam Shells,Clamshell avec élastique
BANDED_EXERCISES_CURL,BANDED_EXERCISES,CURL,Banded Curl,Curl avec élastique
BANDED_EXERCISES_CURL_WHEELCHAIR,BANDED_EXERCISES,CURL_WHEELCHAIR,Banded Bicep Curl,Curl biceps avec élastique
BANDED_EXERCISES_DEADBUG,BANDED_EXERCISES,DEADBUG,Banded Deadbug,Dead bug avec élastique
BANDED_EXERCISES_DEADLIFT,BANDED_EXERCISES,DEADLIFT,Banded Deadlift,Soulevé de terre avec élastique
BANDED_EXERCISES_DONKEY_KICK,BANDED_EXERCISES,DONKEY_KICK,Banded Donkey Kick,Donkey Kick avec élastique
BANDED_EXERCISES_EXTERNAL_ROTATION,BANDED_EXERCISES,EXTERNAL_ROTATION,Banded External Rotation,Rotation externe avec élastique
BANDED_EXERCISES_EXTERNAL_ROTATION_AT_90_DEGREE_ABDUCTION,BANDED_EXERCISES,EXTERNAL_ROTATION_AT_90_DEGREE_ABDUCTION,Banded External Rotation at 90-Degree Abduction,Rotation externe avec élastique à 90 degrés d'abduction
BANDED_EXERCISES_FACE_PULL_WHEELCHAIR,BANDED_EXERCISES,FACE_PULL_WHEELCHAIR,Banded Face Pull,Traction de face avec élastique
BANDED_EXERCISES_FIRE_HYDRANT,BANDED_EXERCISES,FIRE_HYDRANT,Banded Fire Hydrant,Fire Hydrant avec élastique
BANDED_EXERCISES_FLY,BANDED_EXERCISES,FLY,Banded Fly,Écarté avec élastique
BANDED_EXERCISES_FRONT_RAISE,BANDED_EXERCISES,FRONT_RAISE,Banded Front Raise,Élévation avant avec élastique
BANDED_EXERCISES_GLUTE_BRIDGE,BANDED_EXERCISES,GLUTE_BRIDGE,Banded Glute Bridge,Pont avec élastique
BANDED_EXERCISES_HAMSTRING_CURLS,BANDED_EXERCISES,HAMSTRING_CURLS,Banded Hamstring Curls,Curl des ischio-jambiers avec élastique
BANDED_EXERCISES_HIGH_PLANK_LEG_LIFTS,BANDED_EXERCISES,HIGH_PLANK_LEG_LIFTS,Banded High Plank Leg Lifts,Levers de jambes en position planche avec élastique
BANDED_EXERCISES_HIP_EXTENSION,BANDED_EXERCISES,HIP_EXTENSION,Banded Hip Extension,Extension de hanche avec élastique
BANDED_EXERCISES_INTERNAL_ROTATION,BANDED_EXERCISES,INTERNAL_ROTATION,Banded Internal Rotation,Rotation interne avec élastique
BANDED_EXERCISES_JUMPING_JACK,BANDED_EXERCISES,JUMPING_JACK,Banded Jumping Jack,Jumping Jack avec élastique
BANDED_EXERCISES_KNEELING_CRUNCH,BANDED_EXERCISES,KNEELING_CRUNCH,Banded Kneeling Crunch,Crunch à genoux avec élastique
BANDED_EXERCISES_LATERAL_BAND_WALKS,BANDED_EXERCISES,LATERAL_BAND_WALKS,Banded Lateral Band Walks,Déplacements latéraux avec élastique
BANDED_EXERCISES_LATERAL_RAISE,BANDED_EXERCISES,LATERAL_RAISE,Banded Lateral Raise,Élévation latérale avec élastique
BANDED_EXERCISES_LATERAL_RAISE_WHEELCHAIR,BANDED_EXERCISES,LATERAL_RAISE_WHEELCHAIR,Banded Lateral Raise,Élévation latérale avec élastique
BANDED_EXERCISES_LATPULL,BANDED_EXERCISES,LATPULL,Banded Latpull,Pull-down avec élastique
BANDED_EXERCISES_LEG_ABDUCTION,BANDED_EXERCISES,LEG_ABDUCTION,Banded Leg Abduction,Abduction de jambe avec élastique
BANDED_EXERCISES_LEG_ADDUCTION,BANDED_EXERCISES,LEG_ADDUCTION,Banded Leg Adduction,Adduction de jambe avec élastique
BANDED_EXERCISES_LEG_EXTENSION,BANDED_EXERCISES,LEG_EXTENSION,Banded Leg Extension,Extension de jambe avec élastique
BANDED_EXERCISES_LUNGE,BANDED_EXERCISES,LUNGE,Banded Lunge,Fente avec élastique
BANDED_EXERCISES_OVERHEAD_CURL_WHEELCHAIR,BANDED_EXERCISES,OVERHEAD_CURL_WHEELCHAIR,Banded Overhead Curl,Curl haut avec élastique
BANDED_EXERCISES_OVERHEAD_PRESS_WHEELCHAIR,BANDED_EXERCISES,OVERHEAD_PRESS_WHEELCHAIR,Overhead Banded Press,Développé épaules avec élastique
BANDED_EXERCISES_PLANK,BANDED_EXERCISES,PLANK,Banded Plank,Planche avec élastique
BANDED_EXERCISES_PULL_APART,BANDED_EXERCISES,PULL_APART,Banded Pull Apart,Pull-Apart avec élastique
BANDED_EXERCISES_PULL_APART_WHEELCHAIR,BANDED_EXERCISES,PULL_APART_WHEELCHAIR,Banded Pull Apart,Pull-Apart avec élastique
BANDED_EXERCISES_PULL_DOWN_WHEELCHAIR,BANDED_EXERCISES,PULL_DOWN_WHEELCHAIR,Banded Pull-down,Tirage avec élastique
BANDED_EXERCISES_PUSH_UPS,BANDED_EXERCISES,PUSH_UPS,Banded Push-ups,Pompes avec élastique
BANDED_EXERCISES_REVERSE_CRUNCH,BANDED_EXERCISES,REVERSE_CRUNCH,Banded Reverse Crunch,Crunch inversé avec élastique
BANDED_EXERCISES_ROW,BANDED_EXERCISES,ROW,Banded Row,Rowing avec élastique
BANDED_EXERCISES_SHOULDER_ABDUCTION,BANDED_EXERCISES,SHOULDER_ABDUCTION,Banded Shoulder Abduction,Abduction d'épaule avec élastique
BANDED_EXERCISES_SHOULDER_EXTENSION,BANDED_EXERCISES,SHOULDER_EXTENSION,Banded Shoulder Extension,Extension d'épaule avec élastique
BANDED_EXERCISES_SHOULDER_EXTERNAL_ROTATION,BANDED_EXERCISES,SHOULDER_EXTERNAL_ROTATION,Banded Shoulder External Rotation,Rotation externe de l'épaule avec élastique
BANDED_EXERCISES_SHOULDER_FLEXION_TO_90_DEGREES,BANDED_EXERCISES,SHOULDER_FLEXION_TO_90_DEGREES,Banded Shoulder Flexion to 90-Degrees,Flexion de l'épaule à 90 degrés avec élastique
BANDED_EXERCISES_SIDE_CURL_WHEELCHAIR,BANDED_EXERCISES,SIDE_CURL_WHEELCHAIR,Banded Side Curl,Curl latéral avec élastique
BANDED_EXERCISES_SIDE_PLANK_LEG_LIFTS,BANDED_EXERCISES,SIDE_PLANK_LEG_LIFTS,Banded Side Plank Leg Lifts,Lever de jambe en planche latérale avec élastique
BANDED_EXERCISES_SQUAT,BANDED_EXERCISES,SQUAT,Banded Squat,Squat avec élastique
BANDED_EXERCISES_SQUAT_TO_PRESS,BANDED_EXERCISES,SQUAT_TO_PRESS,Banded Squat to Press,Squat et presse avec élastique
BANDED_EXERCISES_STRAIGHT_ARM_PULL_DOWN_WHEELCHAIR,BANDED_EXERCISES,STRAIGHT_ARM_PULL_DOWN_WHEELCHAIR,Banded Straight-arm Pull-down,Tirage bras tendus avec élastique
BANDED_EXERCISES_TRICEPS_EXTENSION_WHEELCHAIR,BANDED_EXERCISES,TRICEPS_EXTENSION_WHEELCHAIR,Banded Triceps Extension,Extension des triceps avec élastique
BANDED_EXERCISES_TRICEP_EXTENSION,BANDED_EXERCISES,TRICEP_EXTENSION,Banded Tricep Extension,Extension du triceps avec élastique
BANDED_EXERCISES_TRICEP_KICKBACK,BANDED_EXERCISES,TRICEP_KICKBACK,Banded Tricep Kick-back,Triceps Kick-back avec élastique
BANDED_EXERCISES_UPRIGHT_ROW,BANDED_EXERCISES,UPRIGHT_ROW,Banded Upright Row,Rowing vertical avec élastique
BANDED_EXERCISES_WALL_CRAWL_WITH_EXTERNAL_ROTATION,BANDED_EXERCISES,WALL_CRAWL_WITH_EXTERNAL_ROTATION,Banded Wall Crawl with External Rotation,Crawl mural avec rotation externe avec élastique
BATTLE_ROPE_ALTERNATING_FIGURE_EIGHT,BATTLE_ROPE,ALTERNATING_FIGURE_EIGHT,Battle Rope Alternating Figure Eight,Corde de combat - Figure huit en alternance
BATTLE_ROPE_ALTERNATING_JUMP_WAVE,BATTLE_ROPE,ALTERNATING_JUMP_WAVE,Battle Rope Alternating Jump Wave,Corde de combat - Vague et saut en alternance
BATTLE_ROPE_ALTERNATING_KNEELING_TO_STANDING_WAVE,BATTLE_ROPE,ALTERNATING_KNEELING_TO_STANDING_WAVE,Battle Rope Alternating Kneeling to Standing Wave,Corde de combat - Vague à genoux et debout en alternance
BATTLE_ROPE_ALTERNATING_LUNGE_WAVE,BATTLE_ROPE,ALTERNATING_LUNGE_WAVE,Battle Rope Alternating Lunge Wave,Corde de combat - Vague et fente en alternance
BATTLE_ROPE_ALTERNATING_SQUAT_WAVE,BATTLE_ROPE,ALTERNATING_SQUAT_WAVE,Battle Rope Alternating Squat Wave,Corde de combat - Vague et squat en alternance
BATTLE_ROPE_ALTERNATING_WAVE,BATTLE_ROPE,ALTERNATING_WAVE,Battle Rope Alternating Wave,Corde de combat - Vague en alternance
BATTLE_ROPE_ALTERNATING_WAVE_WITH_LATERAL_SHUFFLE,BATTLE_ROPE,ALTERNATING_WAVE_WITH_LATERAL_SHUFFLE,Battle Rope Alternating Wave with Lateral Shuffle,Corde de combat - Vague et Shuffle latéral en alternance
BATTLE_ROPE_BATTLE_ROPE,BATTLE_ROPE,BATTLE_ROPE,Battle Rope,Corde de combat
BATTLE_ROPE_CLAP_WAVE,BATTLE_ROPE,CLAP_WAVE,Battle Rope Clap Wave,Corde de combat - Vague clapée
BATTLE_ROPE_DOUBLE_ARM_FIGURE_EIGHT,BATTLE_ROPE,DOUBLE_ARM_FIGURE_EIGHT,Battle Rope Double-arm Figure Eight,Corde de combat - Figure huit à deux bras
BATTLE_ROPE_DOUBLE_ARM_SIDE_TO_SIDE_SNAKE,BATTLE_ROPE,DOUBLE_ARM_SIDE_TO_SIDE_SNAKE,Battle Rope Double Arm Side-to-Side Snake,Corde de combat - Serpent de côté à côté à deux bras
BATTLE_ROPE_DOUBLE_ARM_SIDE_WAVE,BATTLE_ROPE,DOUBLE_ARM_SIDE_WAVE,Battle Rope Double-arm Side Wave,Corde de combat - Vague côté à deux bras
BATTLE_ROPE_DOUBLE_ARM_SLAM,BATTLE_ROPE,DOUBLE_ARM_SLAM,Battle Rope Double-arm Slam,Corde de combat - Claquement à deux bras
BATTLE_ROPE_DOUBLE_ARM_WAVE,BATTLE_ROPE,DOUBLE_ARM_WAVE,Battle Rope Double-arm Wave,Corde de combat - Vague à deux bras
BATTLE_ROPE_GRAPPLER_TOSS,BATTLE_ROPE,GRAPPLER_TOSS,Battle Rope Grappler Toss,Corde de combat - Grappler Toss
BATTLE_ROPE_HIP_TOSS,BATTLE_ROPE,HIP_TOSS,Battle Rope Hip Toss,Corde de combat - Hip Toss
BATTLE_ROPE_INSIDE_CIRCLE,BATTLE_ROPE,INSIDE_CIRCLE,Battle Rope Inside Circle,Corde de combat - Cercle intérieur
BATTLE_ROPE_IN_AND_OUT_WAVE,BATTLE_ROPE,IN_AND_OUT_WAVE,Battle Rope In and Out Wave,Corde de combat - Vague intérieur/extérieur
BATTLE_ROPE_JUMPING_JACKS,BATTLE_ROPE,JUMPING_JACKS,Battle Rope Jumping Jacks,Corde de combat - Jumping Jacks
BATTLE_ROPE_OUTSIDE_CIRCLE,BATTLE_ROPE,OUTSIDE_CIRCLE,Battle Rope Outside Circle,Corde de combat - Cercle extérieur
BATTLE_ROPE_RAINBOW,BATTLE_ROPE,RAINBOW,Battle Rope Rainbow,Corde de combat - Rainbow
BATTLE_ROPE_SIDEWINDER,BATTLE_ROPE,SIDEWINDER,Battle Rope Sidewinder,Corde de combat - Sidewinder
BATTLE_ROPE_SIDE_PLANK_WAVE,BATTLE_ROPE,SIDE_PLANK_WAVE,Battle Rope Side Plank Wave,Corde de combat - Vague en planche latérale
BATTLE_ROPE_SITTING_RUSSIAN_TWIST,BATTLE_ROPE,SITTING_RUSSIAN_TWIST,Battle Rope Sitting Russian Twist,Corde de combat - Torsion oblique assis
BATTLE_ROPE_SNAKE_WAVE,BATTLE_ROPE,SNAKE_WAVE,Battle Rope Snake Wave,Corde de combat - Vague serpent
BATTLE_ROPE_SPLIT_JACK,BATTLE_ROPE,SPLIT_JACK,Battle Rope Split Jack,Corde de combat - Jack fendu
BATTLE_ROPE_STAGE_COACH,BATTLE_ROPE,STAGE_COACH,Battle Rope Stage Coach,Corde de combat - Stage Coach
BATTLE_ROPE_ULTIMATE_WARRIOR,BATTLE_ROPE,ULTIMATE_WARRIOR,Battle Rope Ultimate Warrior,Corde de combat - Ultimate Warrior
BATTLE_ROPE_UPPER_CUTS,BATTLE_ROPE,UPPER_CUTS,Battle Rope Upper Cuts,Corde de combat - Uppercuts
BENCH_PRESS_ALTERNATING_DUMBBELL_CHEST_PRESS,BENCH_PRESS,ALTERNATING_DUMBBELL_CHEST_PRESS,Alternating Dumbbell Chest Press,Développé alterné du torse avec haltères
BENCH_PRESS_ALTERNATING_DUMBBELL_CHEST_PRESS_ON_SWISS_BALL,BENCH_PRESS,ALTERNATING_DUMBBELL_CHEST_PRESS_ON_SWISS_BALL,Alternating Dumbbell Chest Press on Swiss Ball,Développés couché alternés avec haltères sur ballon d'exercice
BENCH_PRESS_BARBELL_BENCH_PRESS,BENCH_PRESS,BARBELL_BENCH_PRESS,Barbell Bench Press,Développé couché avec barre
BENCH_PRESS_BARBELL_BOARD_BENCH_PRESS,BENCH_PRESS,BARBELL_BOARD_BENCH_PRESS,Barbell Board Bench Press,Développé couché avec planche
BENCH_PRESS_BARBELL_FLOOR_PRESS,BENCH_PRESS,BARBELL_FLOOR_PRESS,Barbell Floor Press,Développé couché au sol avec barre d'altères
BENCH_PRESS_BENCH_PRESS,BENCH_PRESS,BENCH_PRESS,Bench Press,Développé couché
BENCH_PRESS_CLOSE_GRIP_BARBELL_BENCH_PRESS,BENCH_PRESS,CLOSE_GRIP_BARBELL_BENCH_PRESS,Close-grip Barbell Bench Press,Développé couché prise serrée
BENCH_PRESS_DECLINE_DUMBBELL_BENCH_PRESS,BENCH_PRESS,DECLINE_DUMBBELL_BENCH_PRESS,Decline Dumbbell Bench Press,Développé couché décliné
BENCH_PRESS_DUMBBELL_BENCH_PRESS,BENCH_PRESS,DUMBBELL_BENCH_PRESS,Dumbbell Bench Press,Développé couché avec haltères
BENCH_PRESS_DUMBBELL_FLOOR_PRESS,BENCH_PRESS,DUMBBELL_FLOOR_PRESS,Dumbbell Floor Press,Développé couché au sol
BENCH_PRESS_INCLINE_BARBELL_BENCH_PRESS,BENCH_PRESS,INCLINE_BARBELL_BENCH_PRESS,Incline Barbell Bench Press,Développé couché incliné
BENCH_PRESS_INCLINE_DUMBBELL_BENCH_PRESS,BENCH_PRESS,INCLINE_DUMBBELL_BENCH_PRESS,Incline Dumbbell Bench Press,Développé couché incliné avec haltères
BENCH_PRESS_INCLINE_SMITH_MACHINE_BENCH_PRESS,BENCH_PRESS,INCLINE_SMITH_MACHINE_BENCH_PRESS,Incline Smith Machine Bench Press,Développé couché incliné de la machine Smith
BENCH_PRESS_ISOMETRIC_BARBELL_BENCH_PRESS,BENCH_PRESS,ISOMETRIC_BARBELL_BENCH_PRESS,Isometric Barbell Bench Press,Développé couché avec banc isométrique
BENCH_PRESS_KETTLEBELL_CHEST_PRESS,BENCH_PRESS,KETTLEBELL_CHEST_PRESS,Kettlebell Chest Press,Développé pectoraux kettlebell
BENCH_PRESS_NEUTRAL_GRIP_DUMBBELL_BENCH_PRESS,BENCH_PRESS,NEUTRAL_GRIP_DUMBBELL_BENCH_PRESS,Neutral-grip Dumbbell Bench Press,Développé couché avec haltères en prise neutre
BENCH_PRESS_NEUTRAL_GRIP_DUMBBELL_INCLINE_BENCH_PRESS,BENCH_PRESS,NEUTRAL_GRIP_DUMBBELL_INCLINE_BENCH_PRESS,Neutral-grip Dumbbell Incline Bench Press,"Développé couché incliné avec haltères, prise neutre"
BENCH_PRESS_ONE_ARM_FLOOR_PRESS,BENCH_PRESS,ONE_ARM_FLOOR_PRESS,One-arm Floor Press,Développé couché au sol à un bras
BENCH_PRESS_PARTIAL_LOCKOUT,BENCH_PRESS,PARTIAL_LOCKOUT,Partial Lockout,Verrouillage partiel
BENCH_PRESS_REVERSE_GRIP_BARBELL_BENCH_PRESS,BENCH_PRESS,REVERSE_GRIP_BARBELL_BENCH_PRESS,Reverse-grip Barbell Bench Press,Développé couché en supination
BENCH_PRESS_REVERSE_GRIP_INCLINE_BENCH_PRESS,BENCH_PRESS,REVERSE_GRIP_INCLINE_BENCH_PRESS,Reverse-grip Incline Bench Press,Développé couché incliné en supination
BENCH_PRESS_SINGLE_ARM_CABLE_CHEST_PRESS,BENCH_PRESS,SINGLE_ARM_CABLE_CHEST_PRESS,Single-arm Cable Chest Press,Développé pectoraux à un bras sur poulie
BENCH_PRESS_SINGLE_ARM_DUMBBELL_BENCH_PRESS,BENCH_PRESS,SINGLE_ARM_DUMBBELL_BENCH_PRESS,Single-arm Dumbbell Bench Press,Développé couché avec haltères à un bras
BENCH_PRESS_SMITH_MACHINE_BENCH_PRESS,BENCH_PRESS,SMITH_MACHINE_BENCH_PRESS,Smith Machine Bench Press,Développé couché sur Machine Smith
BENCH_PRESS_SWISS_BALL_DUMBBELL_CHEST_PRESS,BENCH_PRESS,SWISS_BALL_DUMBBELL_CHEST_PRESS,Swiss Ball Dumbbell Chest Press,Développés couché avec haltères sur ballon d'exercices
BENCH_PRESS_TRIPLE_STOP_BARBELL_BENCH_PRESS,BENCH_PRESS,TRIPLE_STOP_BARBELL_BENCH_PRESS,Triple-stop Barbell Bench Press,Développé couché arrêté
BENCH_PRESS_WEIGHTED_ONE_ARM_FLOOR_PRESS,BENCH_PRESS,WEIGHTED_ONE_ARM_FLOOR_PRESS,Weighted One-arm Floor Press,Développé-couché unilatéral au sol
BENCH_PRESS_WIDE_GRIP_BARBELL_BENCH_PRESS,BENCH_PRESS,WIDE_GRIP_BARBELL_BENCH_PRESS,Wide-grip Barbell Bench Press,Développé couché prise large
CALF_RAISE_CALF_RAISE,CALF_RAISE,CALF_RAISE,Calf Raise,Extension des mollets
CALF_RAISE_DONKEY_CALF_RAISE,CALF_RAISE,DONKEY_CALF_RAISE,Donkey Calf Raise,"Lever de mollet, exercice du chameau"
CALF_RAISE_SEATED_CALF_RAISE,CALF_RAISE,SEATED_CALF_RAISE,Seated Calf Raise,Exercice de mollet assis
CALF_RAISE_SEATED_DUMBBELL_TOE_RAISE,CALF_RAISE,SEATED_DUMBBELL_TOE_RAISE,Seated Dumbbell Toe Raise,Elévation des orteils assis avec haltères
CALF_RAISE_SINGLE_LEG_BENT_KNEE_CALF_RAISE,CALF_RAISE,SINGLE_LEG_BENT_KNEE_CALF_RAISE,Single-leg Bent-knee Calf Raise,"Lever de mollet sur une jambe, genou fléchi"
CALF_RAISE_SINGLE_LEG_DECLINE_PUSH_UP,CALF_RAISE,SINGLE_LEG_DECLINE_PUSH_UP,Single-leg Decline Push-up,Pompe sur une jambe avec pieds surélevés
CALF_RAISE_SINGLE_LEG_DONKEY_CALF_RAISE,CALF_RAISE,SINGLE_LEG_DONKEY_CALF_RAISE,Single-leg Donkey Calf Raise,"Lever de mollet sur une jambe, exercice du chameau"
CALF_RAISE_SINGLE_LEG_HIP_RAISE_WITH_KNEE_HOLD,CALF_RAISE,SINGLE_LEG_HIP_RAISE_WITH_KNEE_HOLD,Single-leg Hip Raise with Knee Hold,Extension des hanches sur une jambe avec main sur genou
CALF_RAISE_SINGLE_LEG_STANDING_CALF_RAISE,CALF_RAISE,SINGLE_LEG_STANDING_CALF_RAISE,Single-leg Standing Calf Raise,Extension des mollets sur une jambe
CALF_RAISE_SINGLE_LEG_STANDING_DUMBBELL_CALF_RAISE,CALF_RAISE,SINGLE_LEG_STANDING_DUMBBELL_CALF_RAISE,Single-leg Standing Dumbbell Calf Raise,Lever de mollet debout sur une jambe avec haltère
CALF_RAISE_STANDING_BARBELL_CALF_RAISE,CALF_RAISE,STANDING_BARBELL_CALF_RAISE,Standing Barbell Calf Raise,Extension des mollets debout avec barre de poids
CALF_RAISE_STANDING_CALF_RAISE,CALF_RAISE,STANDING_CALF_RAISE,Standing Calf Raise,Exercice de mollet debout
CALF_RAISE_STANDING_DUMBBELL_CALF_RAISE,CALF_RAISE,STANDING_DUMBBELL_CALF_RAISE,Standing Dumbbell Calf Raise,Lever de mollet debout avec haltères
CALF_RAISE_WEIGHTED_DONKEY_CALF_RAISE,CALF_RAISE,WEIGHTED_DONKEY_CALF_RAISE,Weighted Donkey Calf Raise,Chameau avec poids
CALF_RAISE_WEIGHTED_SEATED_CALF_RAISE,CALF_RAISE,WEIGHTED_SEATED_CALF_RAISE,Weighted Seated Calf Raise,Extension des mollets assis avec poids
CALF_RAISE_WEIGHTED_SINGLE_LEG_BENT_KNEE_CALF_RAISE,CALF_RAISE,WEIGHTED_SINGLE_LEG_BENT_KNEE_CALF_RAISE,Weighted Single-leg Bent-knee Calf Raise,Extension des mollets unilatérale genou plié avec poids
CALF_RAISE_WEIGHTED_SINGLE_LEG_DONKEY_CALF_RAISE,CALF_RAISE,WEIGHTED_SINGLE_LEG_DONKEY_CALF_RAISE,Weighted Single-leg Donkey Calf Raise,Chameau sur une jambe avec poids
CALF_RAISE_WEIGHTED_STANDING_CALF_RAISE,CALF_RAISE,WEIGHTED_STANDING_CALF_RAISE,Weighted Standing Calf Raise,Extension des mollets debout avec poids
CALF_RAISE__3_WAY_CALF_RAISE,CALF_RAISE,_3_WAY_CALF_RAISE,3-way Calf Raise,3 exercices pour mollets
CALF_RAISE__3_WAY_SINGLE_LEG_CALF_RAISE,CALF_RAISE,_3_WAY_SINGLE_LEG_CALF_RAISE,3-way Single-leg Calf Raise,3 exercices de mollet sur une jambe
CALF_RAISE__3_WAY_WEIGHTED_CALF_RAISE,CALF_RAISE,_3_WAY_WEIGHTED_CALF_RAISE,3-way Weighted Calf Raise,Extension des mollets sur 3 angles avec poids
CALF_RAISE__3_WAY_WEIGHTED_SINGLE_LEG_CALF_RAISE,CALF_RAISE,_3_WAY_WEIGHTED_SINGLE_LEG_CALF_RAISE,3-way Weighted Single-leg Calf Raise,Extension des mollets sur une jambe sur 3 angles avec poids
CARDIO_BOB_AND_WEAVE_CIRCLE,CARDIO,BOB_AND_WEAVE_CIRCLE,Bob and Weave Circle,Flexions latérales et circulaires
CARDIO_BUTTERFLY_ARMS_WHEELCHAIR,CARDIO,BUTTERFLY_ARMS_WHEELCHAIR,Butterfly Arms,Papillon
CARDIO_CARDIO,CARDIO,CARDIO,Cardio,Cardio
CARDIO_CARDIO_CORE_CRAWL,CARDIO,CARDIO_CORE_CRAWL,Cardio Core Crawl,Exercice de cardio et de gainage rampant
CARDIO_DOUBLE_PUNCH_DOWN_WHEELCHAIR,CARDIO,DOUBLE_PUNCH_DOWN_WHEELCHAIR,Double Punch Down,Extension deux mains vers le bas
CARDIO_DOUBLE_PUNCH_FORWARD_WHEELCHAIR,CARDIO,DOUBLE_PUNCH_FORWARD_WHEELCHAIR,Double Punch Forward,Extension deux mains vers l'avant
CARDIO_DOUBLE_PUNCH_SIDEWAYS_WHEELCHAIR,CARDIO,DOUBLE_PUNCH_SIDEWAYS_WHEELCHAIR,Double Punch Sideways,Extension deux mains sur le côté
CARDIO_DOUBLE_PUNCH_UP_WHEELCHAIR,CARDIO,DOUBLE_PUNCH_UP_WHEELCHAIR,Double Punch Up,Extension deux mains vers le haut
CARDIO_DOUBLE_UNDER,CARDIO,DOUBLE_UNDER,Double Under,Double Under
CARDIO_JUMPING_JACKS,CARDIO,JUMPING_JACKS,Jumping Jacks,Écartés-sautés
CARDIO_JUMP_ROPE,CARDIO,JUMP_ROPE,Jump Rope,Corde à sauter
CARDIO_JUMP_ROPE_CROSSOVER,CARDIO,JUMP_ROPE_CROSSOVER,Jump Rope Crossover,Sauts croisés à la corde
CARDIO_JUMP_ROPE_JOG,CARDIO,JUMP_ROPE_JOG,Jump Rope Jog,Course à la corde à sauter
CARDIO_POLE_DD_FF_UU_WHEELCHAIR,CARDIO,POLE_DD_FF_UU_WHEELCHAIR,Downward Forward Upper,"Barre en bas, en avant, en haut"
CARDIO_POLE_HANDCYCLE_BACKWARD_WHEELCHAIR,CARDIO,POLE_HANDCYCLE_BACKWARD_WHEELCHAIR,Handcycle Backward,Tour de roue à la main vers l'arrière
CARDIO_POLE_HANDCYCLE_FORWARD_WHEELCHAIR,CARDIO,POLE_HANDCYCLE_FORWARD_WHEELCHAIR,Handcycle Forward,Tour de roue à la main vers l'avant
CARDIO_POLE_PADDLE_BACKWARD_WHEELCHAIR,CARDIO,POLE_PADDLE_BACKWARD_WHEELCHAIR,Paddle Backward,Pagayer vers l'arrière
CARDIO_POLE_PADDLE_FORWARD_WHEELCHAIR,CARDIO,POLE_PADDLE_FORWARD_WHEELCHAIR,Paddle Forward,Pagayer vers l'avant
CARDIO_POLE_RAINBOW_WHEELCHAIR,CARDIO,POLE_RAINBOW_WHEELCHAIR,Rainbow,Arc-en-ciel
CARDIO_PUNCH_BAG_WHEELCHAIR,CARDIO,PUNCH_BAG_WHEELCHAIR,Speed Bag,Sac de frappe
CARDIO_PUNCH_DOWN_WHEELCHAIR,CARDIO,PUNCH_DOWN_WHEELCHAIR,Punch Down,Coup de poing vers le bas
CARDIO_PUNCH_FORWARD_WHEELCHAIR,CARDIO,PUNCH_FORWARD_WHEELCHAIR,Punch Forward,Coup de poing vers l'avant
CARDIO_PUNCH_SIDEWAYS_WHEELCHAIR,CARDIO,PUNCH_SIDEWAYS_WHEELCHAIR,Punch Sideways,Coup de poing latéral
CARDIO_PUNCH_UP_WHEELCHAIR,CARDIO,PUNCH_UP_WHEELCHAIR,Punch Up,Coup de poing vers le haut
CARDIO_ROWING_MACHINE,CARDIO,ROWING_MACHINE,Rowing Machine,Rameur
CARDIO_SITTING_JACKS_WHEELCHAIR,CARDIO,SITTING_JACKS_WHEELCHAIR,Sitting Jacks,Jumping jacks assis
CARDIO_SIT_SKI_WHEELCHAIR,CARDIO,SIT_SKI_WHEELCHAIR,Sit Ski,Skieur assis
CARDIO_SKI_MOGULS,CARDIO,SKI_MOGULS,Ski Moguls,Ski acrobatique
CARDIO_SPLIT_JACKS,CARDIO,SPLIT_JACKS,Split Jacks,Écartés en fente
CARDIO_SQUAT_JACKS,CARDIO,SQUAT_JACKS,Squat Jacks,Écartés en squat
CARDIO_TRIPLE_UNDER,CARDIO,TRIPLE_UNDER,Triple Under,Triple Under
CARDIO_WEIGHTED_BOB_AND_WEAVE_CIRCLE,CARDIO,WEIGHTED_BOB_AND_WEAVE_CIRCLE,Weighted Bob and Weave Circle,Esquive rotative avec poids
CARDIO_WEIGHTED_CARDIO_CORE_CRAWL,CARDIO,WEIGHTED_CARDIO_CORE_CRAWL,Weighted Cardio Core Crawl,Marche quadrupède cardio avec poids
CARDIO_WEIGHTED_DOUBLE_UNDER,CARDIO,WEIGHTED_DOUBLE_UNDER,Weighted Double Under,Double Under avec corde lestée
CARDIO_WEIGHTED_JUMPING_JACKS,CARDIO,WEIGHTED_JUMPING_JACKS,Weighted Jumping Jacks,Écartés-sautés avec poids
CARDIO_WEIGHTED_JUMP_ROPE,CARDIO,WEIGHTED_JUMP_ROPE,Weighted Jump Rope,Corde à sauter lestée
CARDIO_WEIGHTED_JUMP_ROPE_CROSSOVER,CARDIO,WEIGHTED_JUMP_ROPE_CROSSOVER,Weighted Jump Rope Crossover,Sauts croisés à la corde lestée
CARDIO_WEIGHTED_JUMP_ROPE_JOG,CARDIO,WEIGHTED_JUMP_ROPE_JOG,Weighted Jump Rope Jog,Course à la corde lestée
CARDIO_WEIGHTED_SKI_MOGULS,CARDIO,WEIGHTED_SKI_MOGULS,Weighted Ski Moguls,Ski acrobatique avec poids
CARDIO_WEIGHTED_SPLIT_JACKS,CARDIO,WEIGHTED_SPLIT_JACKS,Weighted Split Jacks,Split Jacks avec poids
CARDIO_WEIGHTED_SQUAT_JACKS,CARDIO,WEIGHTED_SQUAT_JACKS,Weighted Squat Jacks,Écartés en squat avec poids
CARDIO_WEIGHTED_TRIPLE_UNDER,CARDIO,WEIGHTED_TRIPLE_UNDER,Weighted Triple Under,Triple Under avec corde lestée
CARRY_BAR_HOLDS,CARRY,BAR_HOLDS,Bar Holds,Tenue de barre
CARRY_CARRY,CARRY,CARRY,Carry,Transport
CARRY_DUMBBELL_WAITER_CARRY,CARRY,DUMBBELL_WAITER_CARRY,Dumbbell Waiter Carry,Porté du serveur avec haltère
CARRY_FARMERS_CARRY,CARRY,FARMERS_CARRY,Farmer's Carry,Marche du fermier
CARRY_FARMERS_CARRY_ON_TOES,CARRY,FARMERS_CARRY_ON_TOES,Farmer's Carry on Toes,Marche du fermier sur pointe des pieds
CARRY_FARMERS_CARRY_WALK_LUNGE,CARRY,FARMERS_CARRY_WALK_LUNGE,Farmer's Carry Walk Lunge,Fentes en marchant du fermier
CARRY_FARMERS_WALK,CARRY,FARMERS_WALK,Farmer's Walk,Marche du fermier
CARRY_FARMERS_WALK_ON_TOES,CARRY,FARMERS_WALK_ON_TOES,Farmer's Walk on Toes,Marche  du fermier
CARRY_HEX_DUMBBELL_HOLD,CARRY,HEX_DUMBBELL_HOLD,Hex Dumbbell Hold,Exercice avec haltère Hex
CARRY_OVERHEAD_CARRY,CARRY,OVERHEAD_CARRY,Overhead Carry,Porté au-dessus de la tête
CHOP_CABLE_PULL_THROUGH,CHOP,CABLE_PULL_THROUGH,Cable Pull-through,Tirage à la poulie
CHOP_CABLE_ROTATIONAL_LIFT,CHOP,CABLE_ROTATIONAL_LIFT,Cable Rotational Lift,Lever avec rotation et câble
CHOP_CABLE_WOODCHOP,CHOP,CABLE_WOODCHOP,Cable Woodchop,Woodchop à la poulie
CHOP_CHOP,CHOP,CHOP,Chop,Chop
CHOP_CROSS_CHOP_TO_KNEE,CHOP,CROSS_CHOP_TO_KNEE,Cross Chop to Knee,Chop transversal vers le genou
CHOP_DUMBBELL_CHOP,CHOP,DUMBBELL_CHOP,Dumbbell Chop,Dumbbell wood chop
CHOP_HALF_KNEELING_ROTATION,CHOP,HALF_KNEELING_ROTATION,Half-kneeling Rotation,Rotation avec demi flexion de genoux
CHOP_HALF_KNEELING_ROTATIONAL_CHOP,CHOP,HALF_KNEELING_ROTATIONAL_CHOP,Half-kneeling Rotational Chop,Chop en rotation avec demi flexion des genoux
CHOP_HALF_KNEELING_ROTATIONAL_REVERSE_CHOP,CHOP,HALF_KNEELING_ROTATIONAL_REVERSE_CHOP,Half-kneeling Rotational Reverse Chop,Chop en rotation inverse à genoux
CHOP_HALF_KNEELING_STABILITY_CHOP,CHOP,HALF_KNEELING_STABILITY_CHOP,Half-kneeling Stability Chop,Chop de stabilisation un genou à terre
CHOP_HALF_KNEELING_STABILITY_REVERSE_CHOP,CHOP,HALF_KNEELING_STABILITY_REVERSE_CHOP,Half-kneeling Stability Reverse Chop,Tirage inversé en stabilité un genou à terre
CHOP_KNEELING_ROTATIONAL_CHOP,CHOP,KNEELING_ROTATIONAL_CHOP,Kneeling Rotational Chop,Chop en rotation à genoux
CHOP_KNEELING_ROTATIONAL_REVERSE_CHOP,CHOP,KNEELING_ROTATIONAL_REVERSE_CHOP,Kneeling Rotational Reverse Chop,Chop en rotation inverse à genoux
CHOP_KNEELING_STABILITY_CHOP,CHOP,KNEELING_STABILITY_CHOP,Kneeling Stability Chop,Chop stabilité à genoux
CHOP_KNEELING_WOODCHOPPER,CHOP,KNEELING_WOODCHOPPER,Kneeling Woodchopper,Bûcheron à genoux
CHOP_MEDICINE_BALL_WOOD_CHOPS,CHOP,MEDICINE_BALL_WOOD_CHOPS,Medicine Ball Wood Chops,Bûcheron avec médecine ball
CHOP_POWER_SQUAT_CHOPS,CHOP,POWER_SQUAT_CHOPS,Power Squat Chops,Squat en diagonale
CHOP_STANDING_ROTATIONAL_CHOP,CHOP,STANDING_ROTATIONAL_CHOP,Standing Rotational Chop,Chop Rotatif Debout
CHOP_STANDING_SPLIT_ROTATIONAL_CHOP,CHOP,STANDING_SPLIT_ROTATIONAL_CHOP,Standing Split Rotational Chop,Chop rotatif avec fente debout
CHOP_STANDING_SPLIT_ROTATIONAL_REVERSE_CHOP,CHOP,STANDING_SPLIT_ROTATIONAL_REVERSE_CHOP,Standing Split Rotational Reverse Chop,Chop en rotation inverse avec fente debout
CHOP_STANDING_STABILITY_REVERSE_CHOP,CHOP,STANDING_STABILITY_REVERSE_CHOP,Standing Stability Reverse Chop,Tirage inversé en stabilisation debout
CHOP_WEIGHTED_CROSS_CHOP_TO_KNEE,CHOP,WEIGHTED_CROSS_CHOP_TO_KNEE,Weighted Cross Chop to Knee,Chop diagonal et lever de genou avec poids
CHOP_WEIGHTED_HALF_KNEELING_ROTATION,CHOP,WEIGHTED_HALF_KNEELING_ROTATION,Weighted Half-kneeling Rotation,Rotation sur un genou avec poids
