key,category,exerciseName,name_en,name_fr
PUSH_UP_KIPPING_HANDSTAND_PUSH_UP,PUSH_UP,KIPPING_HANDSTAND_PUSH_UP,Kipping Handstand Push-up,Poussée d'appui renversé
PUSH_UP_KIPPING_PARALLETTE_HANDSTAND_PUSH_UP,PUSH_UP,KIPPING_PARALLETTE_HANDSTAND_PUSH_UP,Kipping Parallette Handstand Push-up,Poussée d'appui renversé avec parallette
PUSH_UP_KNEELING_PUSH_UP,PUSH_UP,KNEELING_PUSH_UP,Kneeling Push-up,Pompes à genoux
PUSH_UP_MEDICINE_BALL_CHEST_PASS,PUSH_UP,MEDICINE_BALL_CHEST_PASS,Medicine Ball Chest Pass,Passe à la poitrine avec médecine ball
PUSH_UP_MEDICINE_BALL_PUSH_UP,PUSH_UP,MEDICINE_BALL_PUSH_UP,Medicine Ball Push-up,Pompes sur medicine ball
PUSH_UP_ONE_ARM_PUSH_UP,PUSH_UP,ONE_ARM_PUSH_UP,One-arm Push-up,Pompes sur un bras
PUSH_UP_PARALLETTE_HANDSTAND_PUSH_UP,PUSH_UP,PARALLETTE_HANDSTAND_PUSH_UP,Parallette Handstand Push-up,Pompes verticales avec parallette
PUSH_UP_PIKE_PUSH_UP,PUSH_UP,PIKE_PUSH_UP,Pike Push-up,Pompes épaule
PUSH_UP_PILATES_PUSHUP,PUSH_UP,PILATES_PUSHUP,Pilates Pushup,Pompes Pilates
PUSH_UP_PUSH_UP,PUSH_UP,PUSH_UP,Push-up,Pompe
PUSH_UP_PUSH_UP_AND_ROW,PUSH_UP,PUSH_UP_AND_ROW,Push-up and Row,Pompes et tirage
PUSH_UP_PUSH_UP_PLUS,PUSH_UP,PUSH_UP_PLUS,Push-up Plus,Pompes plus
PUSH_UP_PUSH_UP_WITH_FEET_ON_SWISS_BALL,PUSH_UP,PUSH_UP_WITH_FEET_ON_SWISS_BALL,Push-up with Feet on Swiss Ball,Pompes avec les pieds sur un ballon d'exercice
PUSH_UP_PUSH_UP_WITH_ONE_HAND_ON_MEDICINE_BALL,PUSH_UP,PUSH_UP_WITH_ONE_HAND_ON_MEDICINE_BALL,Push-up with One Hand on Medicine Ball,Pompes avec une main sur le medicine ball
PUSH_UP_RING_HANDSTAND_PUSH_UP,PUSH_UP,RING_HANDSTAND_PUSH_UP,Ring Handstand Push-up,Pompes verticales aux anneaux
PUSH_UP_RING_PUSH_UP,PUSH_UP,RING_PUSH_UP,Ring Push-up,Pompes aux anneaux
PUSH_UP_SHOULDER_PUSH_UP,PUSH_UP,SHOULDER_PUSH_UP,Shoulder Push-up,Pompes en V
PUSH_UP_SHOULDER_TAPPING_PUSH_UP,PUSH_UP,SHOULDER_TAPPING_PUSH_UP,Shoulder Tapping Push-up,Pompes touché épaule
PUSH_UP_SINGLE_ARM_MEDICINE_BALL_PUSH_UP,PUSH_UP,SINGLE_ARM_MEDICINE_BALL_PUSH_UP,Single-arm Medicine Ball Push-up,Pompes sur medicine ball à un bras
PUSH_UP_SPIDERMAN_PUSH_UP,PUSH_UP,SPIDERMAN_PUSH_UP,Spiderman Push-up,Pompe Spiderman
PUSH_UP_STACKED_FEET_PUSH_UP,PUSH_UP,STACKED_FEET_PUSH_UP,Stacked-feet Push-up,Pompes pieds croisés
PUSH_UP_STAGGERED_HANDS_PUSH_UP,PUSH_UP,STAGGERED_HANDS_PUSH_UP,Staggered-hands Push-up,Pompes mains décalées
PUSH_UP_SUSPENDED_PUSH_UP,PUSH_UP,SUSPENDED_PUSH_UP,Suspended Push-up,Pompes en suspension
PUSH_UP_SWISS_BALL_PUSH_UP,PUSH_UP,SWISS_BALL_PUSH_UP,Swiss Ball Push-up,Pompes sur ballon d'exercice
PUSH_UP_SWISS_BALL_PUSH_UP_PLUS,PUSH_UP,SWISS_BALL_PUSH_UP_PLUS,Swiss Ball Push-up Plus,Pompes plus sur ballon d'exercice
PUSH_UP_TRIPLE_STOP_PUSH_UP,PUSH_UP,TRIPLE_STOP_PUSH_UP,Triple-stop Push-up,Pompes arrêtées
PUSH_UP_T_PUSH_UP,PUSH_UP,T_PUSH_UP,T Push-up,Pompes en T
PUSH_UP_WEIGHTED_ALTERNATING_HANDS_MEDICINE_BALL_PUSH_UP,PUSH_UP,WEIGHTED_ALTERNATING_HANDS_MEDICINE_BALL_PUSH_UP,Weighted Alternating-hands Medicine Ball Push-up,Pompes alternées sur medicine ball avec poids
PUSH_UP_WEIGHTED_ALTERNATING_STAGGERED_PUSH_UP,PUSH_UP,WEIGHTED_ALTERNATING_STAGGERED_PUSH_UP,Weighted Alternating Staggered Push-up,Pompes décalées en alternance avec poids
PUSH_UP_WEIGHTED_BICEPS_PUSH_UP,PUSH_UP,WEIGHTED_BICEPS_PUSH_UP,Weighted Biceps Push-up,Pompes biceps lestées
PUSH_UP_WEIGHTED_BOSU_BALL_PUSH_UP,PUSH_UP,WEIGHTED_BOSU_BALL_PUSH_UP,Weighted Push-up on Bosu® Balance Trainer,Pompe lestée sur Bosu® Balance Trainer
PUSH_UP_WEIGHTED_CLAPPING_PUSH_UP,PUSH_UP,WEIGHTED_CLAPPING_PUSH_UP,Weighted Clapping Push-up,Pompes claquées avec poids
PUSH_UP_WEIGHTED_CLOSE_GRIP_MEDICINE_BALL_PUSH_UP,PUSH_UP,WEIGHTED_CLOSE_GRIP_MEDICINE_BALL_PUSH_UP,Weighted Close-grip Medicine Ball Push-up,Pompes sur medicine ball avec poids
PUSH_UP_WEIGHTED_CLOSE_HANDS_PUSH_UP,PUSH_UP,WEIGHTED_CLOSE_HANDS_PUSH_UP,Weighted Close-hands Push-up,Pompes mains rapprochées avec poids
PUSH_UP_WEIGHTED_DECLINE_PUSH_UP,PUSH_UP,WEIGHTED_DECLINE_PUSH_UP,Weighted Decline Push-up,Pompes pieds surélevés avec poids
PUSH_UP_WEIGHTED_DIAMOND_PUSH_UP,PUSH_UP,WEIGHTED_DIAMOND_PUSH_UP,Weighted Diamond Push-up,Pompes en triangle avec poids
PUSH_UP_WEIGHTED_EXPLOSIVE_CROSSOVER_PUSH_UP,PUSH_UP,WEIGHTED_EXPLOSIVE_CROSSOVER_PUSH_UP,Weighted Explosive Crossover Push-up,Pompes transversales sautées avec poids
PUSH_UP_WEIGHTED_EXPLOSIVE_PUSH_UP,PUSH_UP,WEIGHTED_EXPLOSIVE_PUSH_UP,Weighted Explosive Push-up,Pompes explosives avec poids
PUSH_UP_WEIGHTED_FEET_ELEVATED_SIDE_TO_SIDE_PUSH_UP,PUSH_UP,WEIGHTED_FEET_ELEVATED_SIDE_TO_SIDE_PUSH_UP,Weighted Feet-elevated Side-to-Side Push-up,Pompes latérales inclinées avec poids
PUSH_UP_WEIGHTED_HANDSTAND_PUSH_UP,PUSH_UP,WEIGHTED_HANDSTAND_PUSH_UP,Weighted Handstand Push-up,Pompes verticales avec poids
PUSH_UP_WEIGHTED_HAND_RELEASE_PUSH_UP,PUSH_UP,WEIGHTED_HAND_RELEASE_PUSH_UP,Weighted Hand Release Push-up,"Pompes avec mains relevées, avec poids"
PUSH_UP_WEIGHTED_HINDU_PUSH_UP,PUSH_UP,WEIGHTED_HINDU_PUSH_UP,Weighted Hindu Push-up,Pompes Hindu lestées
PUSH_UP_WEIGHTED_INCLINE_PUSH_UP,PUSH_UP,WEIGHTED_INCLINE_PUSH_UP,Weighted Incline Push-up,Pompes déclinées avec poids
PUSH_UP_WEIGHTED_ISOMETRIC_EXPLOSIVE_PUSH_UP,PUSH_UP,WEIGHTED_ISOMETRIC_EXPLOSIVE_PUSH_UP,Weighted Isometric-explosive Push-up,Pompes isométriques explosives avec poids
PUSH_UP_WEIGHTED_JUDO_PUSH_UP,PUSH_UP,WEIGHTED_JUDO_PUSH_UP,Weighted Judo Push-up,Pompes de judo avec poids
PUSH_UP_WEIGHTED_KNEELING_PUSH_UP,PUSH_UP,WEIGHTED_KNEELING_PUSH_UP,Weighted Kneeling Push-up,Pompes à genoux avec poids
PUSH_UP_WEIGHTED_MEDICINE_BALL_PUSH_UP,PUSH_UP,WEIGHTED_MEDICINE_BALL_PUSH_UP,Weighted Medicine Ball Push-up,Pompes sur medicine ball avec poids
PUSH_UP_WEIGHTED_ONE_ARM_PUSH_UP,PUSH_UP,WEIGHTED_ONE_ARM_PUSH_UP,Weighted One-arm Push-up,Pompes sur un bras avec poids
PUSH_UP_WEIGHTED_PARALLETTE_HANDSTAND_PUSH_UP,PUSH_UP,WEIGHTED_PARALLETTE_HANDSTAND_PUSH_UP,Weighted Parallette Handstand Push-up,"Pompes verticales avec parallette, avec poids"
PUSH_UP_WEIGHTED_PIKE_PUSH_UP,PUSH_UP,WEIGHTED_PIKE_PUSH_UP,Weighted Pike Push-up,Pompes épaule lestées
PUSH_UP_WEIGHTED_PUSH_UP,PUSH_UP,WEIGHTED_PUSH_UP,Weighted Push-up,Pompes avec poids
PUSH_UP_WEIGHTED_PUSH_UP_AND_ROW,PUSH_UP,WEIGHTED_PUSH_UP_AND_ROW,Weighted Push-up and Row,Pompes et tirage avec poids
PUSH_UP_WEIGHTED_PUSH_UP_PLUS,PUSH_UP,WEIGHTED_PUSH_UP_PLUS,Weighted Push-up Plus,Pompes plus avec poids
PUSH_UP_WEIGHTED_PUSH_UP_WITH_FEET_ON_SWISS_BALL,PUSH_UP,WEIGHTED_PUSH_UP_WITH_FEET_ON_SWISS_BALL,Weighted Push-up with Feet on Swiss Ball,"Pompes avec les pieds sur un ballon d'exercice, avec poids"
PUSH_UP_WEIGHTED_PUSH_UP_WITH_ONE_HAND_ON_MEDICINE_BALL,PUSH_UP,WEIGHTED_PUSH_UP_WITH_ONE_HAND_ON_MEDICINE_BALL,Weighted Push-up with One Hand on Medicine Ball,"Pompes avec une main sur le medicine ball, avec poids"
PUSH_UP_WEIGHTED_RING_HANDSTAND_PUSH_UP,PUSH_UP,WEIGHTED_RING_HANDSTAND_PUSH_UP,Weighted Ring Handstand Push-up,"Pompes verticales aux anneaux, avec poids"
PUSH_UP_WEIGHTED_RING_PUSH_UP,PUSH_UP,WEIGHTED_RING_PUSH_UP,Weighted Ring Push-up,Pompes avec anneaux lestées
PUSH_UP_WEIGHTED_SHOULDER_PUSH_UP,PUSH_UP,WEIGHTED_SHOULDER_PUSH_UP,Weighted Shoulder Push-up,Pompes en V avec poids
PUSH_UP_WEIGHTED_SINGLE_ARM_MEDICINE_BALL_PUSH_UP,PUSH_UP,WEIGHTED_SINGLE_ARM_MEDICINE_BALL_PUSH_UP,Weighted Single-arm Medicine Ball Push-up,Pompes sur medicine ball à un bras avec poids
PUSH_UP_WEIGHTED_SPIDERMAN_PUSH_UP,PUSH_UP,WEIGHTED_SPIDERMAN_PUSH_UP,Weighted Spiderman Push-up,Pompes Spiderman avec poids
PUSH_UP_WEIGHTED_STACKED_FEET_PUSH_UP,PUSH_UP,WEIGHTED_STACKED_FEET_PUSH_UP,Weighted Stacked-feet Push-up,Pompes pieds croisés avec poids
PUSH_UP_WEIGHTED_STAGGERED_HANDS_PUSH_UP,PUSH_UP,WEIGHTED_STAGGERED_HANDS_PUSH_UP,Weighted Staggered-hands Push-up,Pompes mains décalées avec poids
PUSH_UP_WEIGHTED_SUSPENDED_PUSH_UP,PUSH_UP,WEIGHTED_SUSPENDED_PUSH_UP,Weighted Suspended Push-up,Pompes en suspension avec poids
PUSH_UP_WEIGHTED_SWISS_BALL_PUSH_UP,PUSH_UP,WEIGHTED_SWISS_BALL_PUSH_UP,Weighted Swiss Ball Push-up,Pompes sur ballon d'exercice avec poids
PUSH_UP_WEIGHTED_SWISS_BALL_PUSH_UP_PLUS,PUSH_UP,WEIGHTED_SWISS_BALL_PUSH_UP_PLUS,Weighted Swiss Ball Push-up Plus,Pompes plus sur ballon d'exercice avec poids
PUSH_UP_WEIGHTED_TRIPLE_STOP_PUSH_UP,PUSH_UP,WEIGHTED_TRIPLE_STOP_PUSH_UP,Weighted Triple-stop Push-up,Pompes arrêtées avec poids
PUSH_UP_WEIGHTED_T_PUSH_UP,PUSH_UP,WEIGHTED_T_PUSH_UP,Weighted T Push-up,Pompes en T avec poids
PUSH_UP_WEIGHTED_WIDE_HANDS_PUSH_UP,PUSH_UP,WEIGHTED_WIDE_HANDS_PUSH_UP,Weighted Wide-hands Push-up,Pompes prise large avec poids
PUSH_UP_WIDE_GRIP_PUSH_UP,PUSH_UP,WIDE_GRIP_PUSH_UP,Wide-grip Push-up,Pompes prise large
PUSH_UP_WIDE_HANDS_PUSH_UP,PUSH_UP,WIDE_HANDS_PUSH_UP,Wide-hands Push-up,Pompes prise large
ROW_ALTERNATING_DUMBBELL_ROW,ROW,ALTERNATING_DUMBBELL_ROW,Alternating Dumbbell Row,Tirage alterné avec haltères
ROW_BANDED_FACE_PULLS,ROW,BANDED_FACE_PULLS,Banded Face Pulls,Tractions de face avec élastique
ROW_BARBELL_ROW,ROW,BARBELL_ROW,Barbell Row,Rowing barre
ROW_BARBELL_STRAIGHT_LEG_DEADLIFT_TO_ROW,ROW,BARBELL_STRAIGHT_LEG_DEADLIFT_TO_ROW,Barbell Straight-leg Deadlift to Row,Soulevé de terre appui verrouillé sur tirage
ROW_BENT_OVER_ROW_WITH_BARBELL,ROW,BENT_OVER_ROW_WITH_BARBELL,Bent-over Row with Barbell,Rowing barre buste penché
ROW_BENT_OVER_ROW_WITH_DUMBELL,ROW,BENT_OVER_ROW_WITH_DUMBELL,Bent-over Row with Dumbbell,Rowing haltère buste penché
ROW_CABLE_ROW_STANDING,ROW,CABLE_ROW_STANDING,Cable Row Standing,Rameur debout à poulie
ROW_CHEST_SUPPORTED_DUMBBELL_ROW,ROW,CHEST_SUPPORTED_DUMBBELL_ROW,Chest Supported Dumbbell Row,Rowing haltère soutenu par le buste
ROW_DECLINE_RING_ROW,ROW,DECLINE_RING_ROW,Decline Ring Row,Rowing anneaux incliné
ROW_DUMBBELL_ROW,ROW,DUMBBELL_ROW,Dumbbell Row,Tirage avec haltères
ROW_DUMBBELL_ROW_WHEELCHAIR,ROW,DUMBBELL_ROW_WHEELCHAIR,Dumbbell Row,Tirage avec haltères
ROW_ELEVATED_FEET_INVERTED_ROW,ROW,ELEVATED_FEET_INVERTED_ROW,Elevated-feet Inverted Row,Tirage inversé avec pieds surélevés
ROW_ELEVATED_RING_ROW,ROW,ELEVATED_RING_ROW,Elevated Ring Row,Rowing anneaux surélevé
ROW_FACE_PULL,ROW,FACE_PULL,Face Pull,Tirage face
ROW_FACE_PULL_WITH_EXTERNAL_ROTATION,ROW,FACE_PULL_WITH_EXTERNAL_ROTATION,Face Pull with External Rotation,Tirage face avec rotation externe
ROW_INDOOR_ROW,ROW,INDOOR_ROW,Rowing Machine,Rameur
ROW_INVERTED_ROW,ROW,INVERTED_ROW,Inverted Row,Tirage inversé
ROW_INVERTED_ROW_WITH_FEET_ON_SWISS_BALL,ROW,INVERTED_ROW_WITH_FEET_ON_SWISS_BALL,Inverted Row with Feet on Swiss Ball,Tirage inversé avec les pieds sur ballon d'exercice
ROW_KETTLEBELL_ROW,ROW,KETTLEBELL_ROW,Kettlebell Row,Tirage avec kettlebell
ROW_MODIFIED_INVERTED_ROW,ROW,MODIFIED_INVERTED_ROW,Modified Inverted Row,Tirage inversé modifié
ROW_NEUTRAL_GRIP_ALTERNATING_DUMBBELL_ROW,ROW,NEUTRAL_GRIP_ALTERNATING_DUMBBELL_ROW,Neutral-grip Alternating Dumbbell Row,"Tirage alterné avec haltères, prise neutre"
ROW_ONE_ARM_BENT_OVER_ROW,ROW,ONE_ARM_BENT_OVER_ROW,One-arm Bent-over Row,Tirage incliné à un bras
ROW_ONE_LEGGED_DUMBBELL_ROW,ROW,ONE_LEGGED_DUMBBELL_ROW,One-legged Dumbbell Row,Tirage avec haltères sur une jambe
ROW_RENEGADE_ROW,ROW,RENEGADE_ROW,Renegade Row,Tirage en alterné
ROW_REVERSE_GRIP_BARBELL_ROW,ROW,REVERSE_GRIP_BARBELL_ROW,Reverse-grip Barbell Row,Tirage en prise inversée avec barre à disques
ROW_RING_ROW,ROW,RING_ROW,Ring Row,Rowing anneaux
ROW_ROPE_HANDLE_CABLE_ROW,ROW,ROPE_HANDLE_CABLE_ROW,Rope-handle Cable Row,Rameur à poulie avec poignée de corde
ROW_ROW,ROW,ROW,Row,Tirage
ROW_SEATED_CABLE_ROW,ROW,SEATED_CABLE_ROW,Seated Cable Row,Rameur assis
ROW_SEATED_DUMBBELL_ROW,ROW,SEATED_DUMBBELL_ROW,Seated Dumbbell Row,Rameur assis avec haltères
ROW_SEATED_UNDERHAND_GRIP_CABLE_ROW,ROW,SEATED_UNDERHAND_GRIP_CABLE_ROW,Seated Underhand-grip Cable Row,Rowing assis à la poulie basse prise neutre
ROW_SINGLE_ARM_CABLE_ROW,ROW,SINGLE_ARM_CABLE_ROW,Single-arm Cable Row,Rameur À La Poulie À Un Bras
ROW_SINGLE_ARM_CABLE_ROW_AND_ROTATION,ROW,SINGLE_ARM_CABLE_ROW_AND_ROTATION,Single-arm Cable Row and Rotation,Rameur à la poulie à un bras et rotation
ROW_SINGLE_ARM_INVERTED_ROW,ROW,SINGLE_ARM_INVERTED_ROW,Single-arm Inverted Row,Tirage inversé à un bras
ROW_SINGLE_ARM_NEUTRAL_GRIP_DUMBBELL_ROW,ROW,SINGLE_ARM_NEUTRAL_GRIP_DUMBBELL_ROW,Single-arm Neutral-grip Dumbbell Row,Tirage à un bras avec haltère en prise neutre
ROW_SINGLE_ARM_NEUTRAL_GRIP_DUMBBELL_ROW_AND_ROTATION,ROW,SINGLE_ARM_NEUTRAL_GRIP_DUMBBELL_ROW_AND_ROTATION,Single-arm Neutral-grip Dumbbell Row and Rotation,Tirage et rotation à un bras avec haltère en prise neutre
ROW_SUSPENDED_INVERTED_ROW,ROW,SUSPENDED_INVERTED_ROW,Suspended Inverted Row,Tirage inversé en suspension
ROW_TOWEL_GRIP_INVERTED_ROW,ROW,TOWEL_GRIP_INVERTED_ROW,Towel-grip Inverted Row,Tirage inversé avec prise serviette
ROW_TRX_INVERTED_ROW,ROW,TRX_INVERTED_ROW,TRX Inverted Row,Rowing inversé au TRX
ROW_T_BAR_ROW,ROW,T_BAR_ROW,T-Bar Row,Tirage barre en T
ROW_UNDERHAND_GRIP_CABLE_ROW,ROW,UNDERHAND_GRIP_CABLE_ROW,Underhand-grip Cable Row,Rameur à poulie en supination
ROW_V_GRIP_CABLE_ROW,ROW,V_GRIP_CABLE_ROW,V-grip Cable Row,Rameur Poignée En V
ROW_WEIGHTED_ELEVATED_FEET_INVERTED_ROW,ROW,WEIGHTED_ELEVATED_FEET_INVERTED_ROW,Weighted Elevated-feet Inverted Row,"Tirage inversé avec pieds surélevés, avec poids"
ROW_WEIGHTED_INVERTED_ROW,ROW,WEIGHTED_INVERTED_ROW,Weighted Inverted Row,Rowing inversé lesté
ROW_WEIGHTED_INVERTED_ROW_WITH_FEET_ON_SWISS_BALL,ROW,WEIGHTED_INVERTED_ROW_WITH_FEET_ON_SWISS_BALL,Weighted Inverted Row with Feet on Swiss Ball,"Tirage inversé avec pieds sur un ballon d'exercice, avec poids"
ROW_WEIGHTED_MODIFIED_INVERTED_ROW,ROW,WEIGHTED_MODIFIED_INVERTED_ROW,Weighted Modified Inverted Row,Tirage inversé modifié avec poids
ROW_WEIGHTED_ROW,ROW,WEIGHTED_ROW,Weighted Row,Tirage avec lest
ROW_WEIGHTED_SINGLE_ARM_INVERTED_ROW,ROW,WEIGHTED_SINGLE_ARM_INVERTED_ROW,Weighted Single-arm Inverted Row,Tirage inversé à un bras avec poids
ROW_WEIGHTED_SUSPENDED_INVERTED_ROW,ROW,WEIGHTED_SUSPENDED_INVERTED_ROW,Weighted Suspended Inverted Row,Tirage inversé en suspension avec poids
ROW_WEIGHTED_TOWEL_GRIP_INVERTED_ROW,ROW,WEIGHTED_TOWEL_GRIP_INVERTED_ROW,Weighted Towel-grip Inverted Row,"Tirage inversé avec prise serviette, avec poids"
ROW_WEIGHTED_TRX_INVERTED_ROW,ROW,WEIGHTED_TRX_INVERTED_ROW,Weighted TRX Inverted Row,Rowing inversé au TRX lesté
ROW_WIDE_GRIP_SEATED_CABLE_ROW,ROW,WIDE_GRIP_SEATED_CABLE_ROW,Wide-grip Seated Cable Row,Rameur assis en prise large
SANDBAG_AROUND_THE_WORLD,SANDBAG,AROUND_THE_WORLD,Sandbag Around the World,Tour du monde avec sac de sable
SANDBAG_BACK_SQUAT,SANDBAG,BACK_SQUAT,Sandbag Back Squat,Squat arrière avec sac de sable
SANDBAG_BEAR_CRAWL_PULL_THROUGH,SANDBAG,BEAR_CRAWL_PULL_THROUGH,Sandbag Bear Crawl Pull-through,Marche de l'ours pull-through avec sac de sable
SANDBAG_BEAR_HUG_SQUAT,SANDBAG,BEAR_HUG_SQUAT,Sandbag Bear Hug Squat,Squat de l'ours avec sac de sable
SANDBAG_CLEAN,SANDBAG,CLEAN,Sandbag Clean,Épaulé avec sac de sable
SANDBAG_CLEAN_AND_PRESS,SANDBAG,CLEAN_AND_PRESS,Sandbag Clean and Press,Épaulé-jeté avec sac de sable
SANDBAG_CURL,SANDBAG,CURL,Sandbag Curl,Curl avec sac de sable
SANDBAG_FRONT_CARRY,SANDBAG,FRONT_CARRY,Sandbag Front Carry,Soulevé avant avec sac de sable
SANDBAG_FRONT_SQUAT,SANDBAG,FRONT_SQUAT,Sandbag Front Squat,Front squat avec sac de sable
SANDBAG_LUNGE,SANDBAG,LUNGE,Sandbag Lunge,Fente avec sac de sable
SANDBAG_OVERHEAD_PRESS,SANDBAG,OVERHEAD_PRESS,Sandbag Overhead Press,Jeté au-dessus de la tête avec sac de sable
SANDBAG_PLANK_PULL_THROUGH,SANDBAG,PLANK_PULL_THROUGH,Sandbag Plank Pull-through,Planche pull-through avec sac de sable
SANDBAG_ROTATIONAL_LUNGE,SANDBAG,ROTATIONAL_LUNGE,Sandbag Rotational Lunge,Fente avec rotation avec sac de sable
SANDBAG_ROW,SANDBAG,ROW,Sandbag Row,Rowing sac de sable
SANDBAG_RUSSIAN_TWIST,SANDBAG,RUSSIAN_TWIST,Sandbag Russian Twist,Torsion de buste avec sac de sable
SANDBAG_SANDBAG,SANDBAG,SANDBAG,Sandbag,Sac de sable
SANDBAG_SHOULDERING,SANDBAG,SHOULDERING,Sandbag Shouldering,Shouldering avec sac de sable
SANDBAG_SHOVELING,SANDBAG,SHOVELING,Sandbag Shoveling,Déblayage avec sac de sable
SANDBAG_SIDE_LUNGE,SANDBAG,SIDE_LUNGE,Sandbag Side Lunge,Fente latérale avec sac de sable
SANDBAG_SPRINT,SANDBAG,SPRINT,Sandbag Sprint,Sprint avec sac de sable
SANDBAG_ZERCHER_SQUAT,SANDBAG,ZERCHER_SQUAT,Sandbag Zercher Squat,Zercher Squat avec sac de sable
SHOULDER_PRESS_ALTERNATING_DUMBBELL_SHOULDER_PRESS,SHOULDER_PRESS,ALTERNATING_DUMBBELL_SHOULDER_PRESS,Alternating Dumbbell Shoulder Press,Développé alterné avec haltères
SHOULDER_PRESS_ARNOLD_PRESS,SHOULDER_PRESS,ARNOLD_PRESS,Arnold Press,Développé Arnold
SHOULDER_PRESS_ARNOLD_PRESS_WHEELCHAIR,SHOULDER_PRESS,ARNOLD_PRESS_WHEELCHAIR,Arnold Press,Développé épaules
SHOULDER_PRESS_BARBELL_FRONT_SQUAT_TO_PUSH_PRESS,SHOULDER_PRESS,BARBELL_FRONT_SQUAT_TO_PUSH_PRESS,Barbell Front Squat to Push Press,Squat avant avec barre et développé poussé
SHOULDER_PRESS_BARBELL_PUSH_PRESS,SHOULDER_PRESS,BARBELL_PUSH_PRESS,Barbell Push Press,Développé poussé avec barre à disques
SHOULDER_PRESS_BARBELL_SHOULDER_PRESS,SHOULDER_PRESS,BARBELL_SHOULDER_PRESS,Barbell Shoulder Press,Développé militaire debout avec barre d'haltères
SHOULDER_PRESS_DEAD_CURL_PRESS,SHOULDER_PRESS,DEAD_CURL_PRESS,Dead-curl Press,Presse Dead-curl
SHOULDER_PRESS_DUMBBELL_ALTERNATING_SHOULDER_PRESS_AND_TWIST,SHOULDER_PRESS,DUMBBELL_ALTERNATING_SHOULDER_PRESS_AND_TWIST,Dumbbell Alternating Shoulder Press and Twist,Développé épaule alterné avec haltères et torsion
SHOULDER_PRESS_DUMBBELL_CURL_TO_OVERHEAD_PRESS_WHEELCHAIR,SHOULDER_PRESS,DUMBBELL_CURL_TO_OVERHEAD_PRESS_WHEELCHAIR,Curl to Overhead Press,Curl avec développé épaules
SHOULDER_PRESS_DUMBBELL_FRONT_RAISE,SHOULDER_PRESS,DUMBBELL_FRONT_RAISE,Dumbbell Front Raise,Soulevé avant avec haltère
SHOULDER_PRESS_DUMBBELL_HAMMER_CURL_TO_LUNGE_TO_PRESS,SHOULDER_PRESS,DUMBBELL_HAMMER_CURL_TO_LUNGE_TO_PRESS,Dumbbell Hammer Curl to Lunge to Press,"Flexion des biceps, suivie de fente et développé"
SHOULDER_PRESS_DUMBBELL_PUSH_PRESS,SHOULDER_PRESS,DUMBBELL_PUSH_PRESS,Dumbbell Push Press,Développé poussé avec haltères
SHOULDER_PRESS_DUMBBELL_SHOULDER_PRESS,SHOULDER_PRESS,DUMBBELL_SHOULDER_PRESS,Dumbbell Shoulder Press,Développé avec haltères
SHOULDER_PRESS_FLOOR_INVERTED_SHOULDER_PRESS,SHOULDER_PRESS,FLOOR_INVERTED_SHOULDER_PRESS,Floor Inverted Shoulder Press,Développé au sol
SHOULDER_PRESS_INVERTED_SHOULDER_PRESS,SHOULDER_PRESS,INVERTED_SHOULDER_PRESS,Inverted Shoulder Press,Développé au sol avec banc
SHOULDER_PRESS_MILITARY_PRESS,SHOULDER_PRESS,MILITARY_PRESS,Military Press,Développé militaire
SHOULDER_PRESS_ONE_ARM_PUSH_PRESS,SHOULDER_PRESS,ONE_ARM_PUSH_PRESS,One-arm Push Press,Développé poussé à un bras
SHOULDER_PRESS_OVERHEAD_BARBELL_PRESS,SHOULDER_PRESS,OVERHEAD_BARBELL_PRESS,Barbell Overhead Press,Développé militaire avec barre
SHOULDER_PRESS_OVERHEAD_DUMBBELL_PRESS,SHOULDER_PRESS,OVERHEAD_DUMBBELL_PRESS,Overhead Dumbbell Press,Développé avec haltères
SHOULDER_PRESS_OVERHEAD_DUMBBELL_PRESS_WHEELCHAIR,SHOULDER_PRESS,OVERHEAD_DUMBBELL_PRESS_WHEELCHAIR,Overhead Dumbbell Press,Développé épaules avec haltères
SHOULDER_PRESS_SEATED_BARBELL_SHOULDER_PRESS,SHOULDER_PRESS,SEATED_BARBELL_SHOULDER_PRESS,Seated Barbell Shoulder Press,Développé assis avec barre à disques
SHOULDER_PRESS_SEATED_DUMBBELL_SHOULDER_PRESS,SHOULDER_PRESS,SEATED_DUMBBELL_SHOULDER_PRESS,Seated Dumbbell Shoulder Press,Développé assis avec haltères
SHOULDER_PRESS_SHOULDER_PRESS,SHOULDER_PRESS,SHOULDER_PRESS,Shoulder Press,Développé
SHOULDER_PRESS_SINGLE_ARM_DUMBBELL_SHOULDER_PRESS,SHOULDER_PRESS,SINGLE_ARM_DUMBBELL_SHOULDER_PRESS,Single-arm Dumbbell Shoulder Press,Développé d'un seul bras avec haltère
SHOULDER_PRESS_SINGLE_ARM_STEP_UP_AND_PRESS,SHOULDER_PRESS,SINGLE_ARM_STEP_UP_AND_PRESS,Single-arm Step-up and Press,Step et développé à un bras
SHOULDER_PRESS_SMITH_MACHINE_OVERHEAD_PRESS,SHOULDER_PRESS,SMITH_MACHINE_OVERHEAD_PRESS,Smith Machine Overhead Press,Développé sur machine Smith
SHOULDER_PRESS_SPLIT_STANCE_HAMMER_CURL_TO_PRESS,SHOULDER_PRESS,SPLIT_STANCE_HAMMER_CURL_TO_PRESS,Split-stance Hammer Curl to Press,Fente avec flexion biceps à développé
SHOULDER_PRESS_STRICT_PRESS,SHOULDER_PRESS,STRICT_PRESS,Strict Press,Développé strict
SHOULDER_PRESS_SWISS_BALL_DUMBBELL_SHOULDER_PRESS,SHOULDER_PRESS,SWISS_BALL_DUMBBELL_SHOULDER_PRESS,Swiss Ball Dumbbell Shoulder Press,Développé avec haltère sur ballon d'exercice
SHOULDER_PRESS_WEIGHTED_FLOOR_INVERTED_SHOULDER_PRESS,SHOULDER_PRESS,WEIGHTED_FLOOR_INVERTED_SHOULDER_PRESS,Weighted Floor Inverted Shoulder Press,Développé au sol avec poids
SHOULDER_PRESS_WEIGHTED_INVERTED_SHOULDER_PRESS,SHOULDER_PRESS,WEIGHTED_INVERTED_SHOULDER_PRESS,Weighted Inverted Shoulder Press,Développé inversé avec poids
SHOULDER_PRESS_WEIGHT_PLATE_FRONT_RAISE,SHOULDER_PRESS,WEIGHT_PLATE_FRONT_RAISE,Weight-plate Front Raise,Élévation frontale avec disque
SHOULDER_STABILITY_BAND_EXTERNAL_ROTATION,SHOULDER_STABILITY,BAND_EXTERNAL_ROTATION,Band External Rotation,Rotation externe avec bande élastique
SHOULDER_STABILITY_BAND_INTERNAL_ROTATION,SHOULDER_STABILITY,BAND_INTERNAL_ROTATION,Band Internal Rotation,Rotation interne avec bande élastique
SHOULDER_STABILITY_BENT_ARM_LATERAL_RAISE_AND_EXTERNAL_ROTATION,SHOULDER_STABILITY,BENT_ARM_LATERAL_RAISE_AND_EXTERNAL_ROTATION,Bent-arm Lateral Raise and External Rotation,Élévation latérale avec bras pliés et rotation externe
SHOULDER_STABILITY_CABLE_EXTERNAL_ROTATION,SHOULDER_STABILITY,CABLE_EXTERNAL_ROTATION,Cable External Rotation,Rotation externe avec poste à poulie
SHOULDER_STABILITY_CABLE_INTERNAL_ROTATION,SHOULDER_STABILITY,CABLE_INTERNAL_ROTATION,Cable Internal Rotation,Rotation interne du câble
SHOULDER_STABILITY_DUMBBELL_FACE_PULL_WITH_EXTERNAL_ROTATION,SHOULDER_STABILITY,DUMBBELL_FACE_PULL_WITH_EXTERNAL_ROTATION,Dumbbell Face Pull with External Rotation,"Tirage face avec haltères, rotation externe"
SHOULDER_STABILITY_FLOOR_I_RAISE,SHOULDER_STABILITY,FLOOR_I_RAISE,Floor I Raise,Élévation au sol en I
SHOULDER_STABILITY_FLOOR_T_RAISE,SHOULDER_STABILITY,FLOOR_T_RAISE,Floor T Raise,Élévation au sol en T
SHOULDER_STABILITY_FLOOR_Y_RAISE,SHOULDER_STABILITY,FLOOR_Y_RAISE,Floor Y Raise,Élévation au sol en Y
SHOULDER_STABILITY_INCLINE_I_RAISE,SHOULDER_STABILITY,INCLINE_I_RAISE,Incline I Raise,Élévation inclinée en I
SHOULDER_STABILITY_INCLINE_L_RAISE,SHOULDER_STABILITY,INCLINE_L_RAISE,Incline L Raise,Élévation inclinée en L
SHOULDER_STABILITY_INCLINE_T_RAISE,SHOULDER_STABILITY,INCLINE_T_RAISE,Incline T Raise,Élévation inclinée en T
SHOULDER_STABILITY_INCLINE_W_RAISE,SHOULDER_STABILITY,INCLINE_W_RAISE,Incline W Raise,Levé incliné en W
SHOULDER_STABILITY_INCLINE_Y_RAISE,SHOULDER_STABILITY,INCLINE_Y_RAISE,Incline Y Raise,Levé incliné en Y
SHOULDER_STABILITY_LYING_EXTERNAL_ROTATION,SHOULDER_STABILITY,LYING_EXTERNAL_ROTATION,Lying External Rotation,Rotation externe en position couchée
SHOULDER_STABILITY_LYING_INTERNAL_ROTATION,SHOULDER_STABILITY,LYING_INTERNAL_ROTATION,Lying Internal Rotation,Rotation interne allongée
SHOULDER_STABILITY_SEATED_DUMBBELL_EXTERNAL_ROTATION,SHOULDER_STABILITY,SEATED_DUMBBELL_EXTERNAL_ROTATION,Seated Dumbbell External Rotation,Rotation externe assis avec un haltère
SHOULDER_STABILITY_SEATED_DUMBBELL_INTERNAL_ROTATION,SHOULDER_STABILITY,SEATED_DUMBBELL_INTERNAL_ROTATION,Seated Dumbbell Internal Rotation,Rotation interne assise avec haltère
SHOULDER_STABILITY_SHOULDER_STABILITY,SHOULDER_STABILITY,SHOULDER_STABILITY,Shoulder Stability,Stabilisation de l'épaule
SHOULDER_STABILITY_STANDING_L_RAISE,SHOULDER_STABILITY,STANDING_L_RAISE,Standing L Raise,Élévation L debout
SHOULDER_STABILITY_SWISS_BALL_I_RAISE,SHOULDER_STABILITY,SWISS_BALL_I_RAISE,Swiss Ball I Raise,Levé en I sur ballon d'exercice
SHOULDER_STABILITY_SWISS_BALL_T_RAISE,SHOULDER_STABILITY,SWISS_BALL_T_RAISE,Swiss Ball T Raise,Élévation en T avec ballon d'exercice
SHOULDER_STABILITY_SWISS_BALL_W_RAISE,SHOULDER_STABILITY,SWISS_BALL_W_RAISE,Swiss Ball W Raise,Levé en W sur ballon d'exercice
SHOULDER_STABILITY_SWISS_BALL_Y_RAISE,SHOULDER_STABILITY,SWISS_BALL_Y_RAISE,Swiss Ball Y Raise,Levé en Y sur ballon d'exercice
SHOULDER_STABILITY_WEIGHTED_FLOOR_I_RAISE,SHOULDER_STABILITY,WEIGHTED_FLOOR_I_RAISE,Weighted Floor I Raise,Élévation au sol en I avec poids
SHOULDER_STABILITY_WEIGHTED_FLOOR_T_RAISE,SHOULDER_STABILITY,WEIGHTED_FLOOR_T_RAISE,Weighted Floor T Raise,Élévation du sol en T avec poids
SHOULDER_STABILITY_WEIGHTED_FLOOR_Y_RAISE,SHOULDER_STABILITY,WEIGHTED_FLOOR_Y_RAISE,Weighted Floor Y Raise,Élévation du sol en Y avec poids
SHOULDER_STABILITY_WEIGHTED_INCLINE_I_RAISE,SHOULDER_STABILITY,WEIGHTED_INCLINE_I_RAISE,Weighted Incline I Raise,Élévation inclinée en I avec poids
SHOULDER_STABILITY_WEIGHTED_INCLINE_L_RAISE,SHOULDER_STABILITY,WEIGHTED_INCLINE_L_RAISE,Weighted Incline L Raise,Élévation inclinée en L avec poids
SHOULDER_STABILITY_WEIGHTED_INCLINE_T_RAISE,SHOULDER_STABILITY,WEIGHTED_INCLINE_T_RAISE,Weighted Incline T Raise,Élévation inclinée en T avec poids
SHOULDER_STABILITY_WEIGHTED_INCLINE_W_RAISE,SHOULDER_STABILITY,WEIGHTED_INCLINE_W_RAISE,Weighted Incline W Raise,Élévation inclinée en W avec poids
SHOULDER_STABILITY_WEIGHTED_INCLINE_Y_RAISE,SHOULDER_STABILITY,WEIGHTED_INCLINE_Y_RAISE,Weighted Incline Y Raise,Élévation inclinée en Y avec poids
SHOULDER_STABILITY_WEIGHTED_SWISS_BALL_I_RAISE,SHOULDER_STABILITY,WEIGHTED_SWISS_BALL_I_RAISE,Weighted Swiss Ball I Raise,Élévation en I sur ballon d'exercice avec poids
SHOULDER_STABILITY_WEIGHTED_SWISS_BALL_T_RAISE,SHOULDER_STABILITY,WEIGHTED_SWISS_BALL_T_RAISE,Weighted Swiss Ball T Raise,Élévation en T sur ballon d'exercice avec poids
